Channel,message,category
ImageJ,"Happy birthday, @ctrueden!",love
ImageJ,Quick question because i can't find the answer there (http://imagej.net/Writing_ImageJ2_plugins). Do I put the class file for an imagej2 plugin into the Fiji/plugins folder like  for a imagej1 plugin?,fear
ImageJ,Why not make life easy and Just Use Eclipse/Maven?,anger
ImageJ,"From the perspective of assembling artifacts, it doesn't look like IntelliJ's integration with Maven is very good.",sadness
ImageJ,Looked easy and correct.,joy
ImageJ,@dscho Aha! View > Tool Windows > Maven Projects. And lots of goodies are there!,joy
ImageJ,"I know I should resist replying to that. But I really need to let you know that every single time you make a dick comment like that, it is very hurtful. The emoticon does not make it any less. And I'm sure I'm not the only one. Nowhere did I say the tool was bad. I used language \it doesn't look like\ to imply that that was my impression after 5-10 minutes of searching.",anger
ImageJ,"Look, you made it sound as if IntelliJ is a sucky tool.",anger
ImageJ,And that was wrong.,sadness
ImageJ,"You transformed a positive conversation about how to accomplish things in IntelliJ, into total bullshit. Instantly. Good job.",anger
ImageJ,"Which does not work for me, because it does not use the javac of the specified java8 SDK",sadness
ImageJ,That's why i could not work with the script editor,sadness
ImageJ,"I tried this first, but did not work, so i created the issue mentioned above",sadness
ImageJ,"Yeah, requiring Java 8 was a particularly poor choice from a collaboration/cooperation point of view.",sadness
ImageJ,No javac.jar found (looked in /Users/janosch/Applications/Fiji.app/jars)!,fear
ImageJ,BTW I am not worrying. That design choice is not really affecting me at all.,joy
ImageJ,"And I do not use that software myself, so there you go. All groovy.",joy
ImageJ,"yep, the folder is still there, with a fine looking maven project",joy
ImageJ,"But looks like, that the generated pom is missing stuff like a <ModelVersion>",sadness
ImageJ,"@dietzc Sorry I missed you in #imagejdev yesterday. I was home sick, and by then I had passed out.",sadness
ImageJ,you feel better?,love
ImageJ,Much. I think I had food poisoning.,sadness
ImageJ,damn. i hate food poisonings...,anger
ImageJ,hi @ctrueden and @hinerm  I have a question concerning SciJava (and you are not in the Scijava Channel ;-)).  If I call getPlugin(SomeSciJavaPlugin.class) should I get the first match which is of type SomeSciJavaPlugin or just exactly this plugin?,fear
ImageJ,amazing. thank you,joy
ImageJ,I was thinking we needed Data and Views for model/view separation. But we don't.,joy
ImageJ,and have a nice flight!,love
ImageJ,"It is highly unfortunate that the ImgLib2 Views class is all static methods. We should probably create a ViewService in imagej-common with all the same methods. That way, the behavior becomes extensible. And then recommend that people never use the static Views.",sadness
ImageJ,"It seems it's a critical issue. Might be enough to add `if (srcClass == null) return false;` to `AbstractConverter#canConvert(ConversionRequest)` and `if (src == null) return false;` to `AbstractConverter#canConvert(Class, Class)`. Though the `NullConverter` might then need to override more `canConvert` methods too...",fear
ImageJ,@ctrueden whoops.. didn't see this,sadness
ImageJ,@hinerm Thanks for the bug-fix. I just pushed a different one that is slightly more thorough to the can-convert-nulls branch.,joy
ImageJ,Thanks @hinerm.,love
ImageJ,"It is exciting to think that JavaFX may be able to give us all worlds: standalone (i.e. external JRE), self-contained (i.e., internal JRE), embedded (i.e., applet) and JWS (i.e. launch from web).",joy
ImageJ,Less exciting that Chrome is dropping support for applets and JWS completely soon. :-(,sadness
ImageJ,looking forward to having you back in the office on Monday,love
ImageJ,it is sad to be here alone :'(,sadness
ImageJ,"Yeah, will be happy to be back!",love
ImageJ,So your notes about importClass and importPackage are no longer valid. __Except:__ JavaScript is not discovered properly when launching with Java 8 due to a bug in the ImageJ Launcher.,sadness
ImageJ,"@ctrueden Thanks for the update. I was adding the bit to the wiki so that I don't forget what I found out. Glad to hear that things develop, I will test with the new launcher.",joy
ImageJ,"Everyone FYI: a horrible Updater bug hit ImageJ today, causing the \jars/imagej-2.0.0-rc-30.jar\ file to disappear from the Fiji continuous release. I repaired the update site, and am hoping the  next release build ([currently in progress](http://jenkins.imagej.net/job/Stable-Fiji/)) does not suffer this problem anymore.",fear
ImageJ,The good news is that the Help > Update command of existing installations was basically unaffected.,joy
ImageJ,"Hey. A bit off topic, I tried to get started with imglib2, but found a few obstacles on the website. First on http://fiji.sc/ImgLib2 the link to ImgLib2 javadoc seems dated. What worked for me is http://jenkins.imagej.net/view/ImgLib2/job/ImgLib2-javadoc/javadoc/ maybe this can be updated?",fear
ImageJ,"Then in Documentation -> Getting Started http://fiji.sc/ImgLib2_-_Getting_Started the code is also a bit dated. The first section mostly works, but some parts don't. First problem: in the untangled version of the \long line\ it refers to \ImgFactory\ but the corresponding import is missing.",sadness
ImageJ,I don't like mailing lists - so maybe my suggestion is a bit biased.,sadness
ImageJ,"@emmenlau As for the \documentation\ pages, those are unfortunately not tied to CI so they fall out of date. My personal preference would be to migrate the \documentation\ including \getting started\ into the ImgLib2 Tutorials section, and tie it in to https://github.com/imglib/imglib2-tutorials with the rest.",sadness
ImageJ,"But I personally do not have time to do that. As Johannes says, changes along those lines would greatly benefit the community!",sadness
ImageJ,"If only two people ever edit a wiki, that is a sign that not everybody wants to participate.",sadness
ImageJ,And as a bonus I'll not even bug you about \community\ and \participation\ anymore ;-),joy
ImageJ,Less work for me.,joy
ImageJ,"hm hard to answer. some PRs in Ops are pending because of the ThreadService issue in SciJava-Commons and the bug in ImgLib2-ROI. Anyway, I will let you know tomorrow if I think its super urgent, ok?",sadness
ImageJ,"ok a release would be great, especially if imagej-ops could directly base on the latest versions of scijava-common and imglib2-roi",joy
ImageJ,!!! great ;-),joy
ImageJ,I wonder what it feels like to cut releases on a day that isn't right before a vacation/holiday weekend,sadness
ImageJ,"@hinerm Uh, what? Is it even possible to cut releases on other days? :innocent: ",sadness
ImageJ,"Hi, I am a new fiji user trying to run a macro on images (.zvi) acquired on a fluo microscope. However, fiji does not take the files into account. ",sadness
ImageJ,Can anyone help? Tx,fear
ImageJ,Right now our handling of multi-component images in Micro-Manager is pretty unpleasant; they're split up into \virtual channels\ for display on the ImageJ side.,sadness
ImageJ,"Sorry, should have defined terms.",sadness
ImageJ,"I like that perspective. The current ImageJ2 design agrees with that definition of Channel, but broadens it a little more.",joy
ImageJ,The conflation of channel and component causes a million headaches for us when working with ImageJ rendering stuff.,anger
ImageJ,"(Which would be a ton of work, but ImageJ1's display code is just such a bear)",sadness
ImageJ,"So, a major thing the ImageJ2 team is struggling with is lack of bandwidth to develop the various IJ subsystems needed.",fear
ImageJ,"Because otherwise, the IJ2 display subsystem is going to languish for at least one more year.",fear
ImageJ,We're going to be severely bandwidth-constrained as well; we're just two people and the company we're starting kicks off October 1st.,sadness
ImageJ,"There are lots of advantages to that, too.",joy
ImageJ,I think I got him a little fired up and energized\u2014not sure if he took any of that back to you guys.,joy
ImageJ,We have no shortage of opportunities; we just have to figure out where to assign our effort.,joy
ImageJ,"The main thing I want to move away from, when it comes to RGB/RGBA images, is the dumb packed ints.",anger
ImageJ,"Ahh, gotcha.",joy
ImageJ,"Right now, ImgLib2's approach is a special type called \ARGBType\ which is better than how IJ1 does it, but still a special case in some circumstances.",fear
ImageJ,And @landinig has quite a few words to say to us about that... pointed out a few places where that falls down hard.,sadness
ImageJ,"Yeah, I don't pretend it's ideal.",sadness
ImageJ,MM2.0 is such a radical restructuring though that I had to take opportunities where possible to simplify.,sadness
ImageJ,"Or else we wouldn't have any releases, even alpha releases, for another month at least.",anger
ImageJ,"Completely understood, and I sympathize.",love
ImageJ,BTW 2.0 alpha is available. :),joy
ImageJ,Gratz!,joy
ImageJ,"Oooh, Java 8. That'll be nice.",joy
ImageJ,"Yes, ditching Java 6 is going to solve a lot of problems.",joy
ImageJ,"Okay, thanks for the info! And good luck with everything; sounds like you have a busy month ahead of you.",joy
ImageJ,"Yeah, it's sort of terrifying. Even more than usual. I have to write the 2nd draft of the ImageJ2 paper, and prep my ImageJ2 talk for the conference, and prep the ImageJ OPS workshop for the conference. And as you know, when preparing technical materials like that, a slew of bug-fixes and commits end up going hand in hand with it.",sadness
ImageJ,So I fear lots of user bug reports are going to fall by the wayside for a while... :worried: ,fear
ImageJ,And likewise to you: have fun with MM2.0. :+1:,joy
ImageJ,"Will do, thanks!",love
ImageJ,"@ChrisWeisiger BTW we had a crack at porting SPIMAcquisition (OpenSPIM's MM plugin) to 2.0. We were not successful, in spite of spending 1.5h on it (it was intended as a first assessment how backwards-compatible MM 2.0 will be, and it appears that it won't be backwards-compatible at all; a lot of interfaces/classes have moved locations, therefore it is impossible to write a plugin that works with both 1.4 and 2.0). Not meant as criticism, just letting you know that we faced troubles and decided to stay with 1.4 for the time being.",fear
ImageJ,Hello everybody! I am having some problems with the imagej codestyle/formatter/prefs for eclipse. It seems that imports are reordered (in DefaultOpService for example) and `..<T> implements` is formatted to `..<T>implements`. I am using Eclipse Mars (which may be the issue).,fear
ImageJ,"Alright, thanks! What about the `..<T>implements` thing, though?",joy
ImageJ,No I'm wrong.,sadness
ImageJ,@Squareys Sorry to hear that Mars has problems. But thanks for the heads up; I was _just_ about to switch after @hinerm said things were working well for him (but we didn't test code clean up...),sadness
ImageJ,"Alright, thank you for clarifying, and thanks for helping!",love
ImageJ,"@ctrueden Hi Curtis, maybe you can help me with this: I'm trying to run imagej from eclipse, but it does not load the script editor (it does not exist under File > New >... ) How do I need to configure eclipse to load it from my local imagej-ui-swing project?",fear
ImageJ,Is that good enough?,fear
ImageJ,"For the latter: unlikely before next year, since ditching Java 6 will have serious consequences.",fear
ImageJ,@ctrueden I cannot use ScriptEditorTestDrive for https://github.com/imagej/imagej-ui-swing/issues/52. It cannot reproduce the bug.,fear
ImageJ,@bnorthan absolutely!,joy
ImageJ,"@bnorthan Thanks, will definitely upgrade that before the end of the week, then.",joy
ImageJ,@hinerm Behold! https://github.com/scijava/scijava-common/commit/8166d835d66cc4735b177e7780aaadf73b32d2d9,joy
ImageJ,"@ctrueden Simply put, I sort all my SingletonPlugins in initialize, but their infos currently return null for some reason, they are already in the instance map though.",fear
ImageJ,"Ah, I see DefaultAppService does the plugin handling lazily.",sadness
ImageJ,"Because it takes time during `new Context()` to do all that stuff, which slows down the application startup.",sadness
ImageJ,So we do tons of lazy init stuff in many services.,sadness
ImageJ,"@ctrueden Okay, thanks!",love
ImageJ,"@ctrueden, @hinerm, when calling an op should python lists be automatically converted to java arrays??  \n\nthis does not seem to work...\n```\nphantom=ops.create().img([xSize, ySize)]\n```\n\nto get around it I have to use jarray\n```\n phantom=ops.create().img(array([xSize, ySize], 'l'))\n```\n\n",fear
ImageJ, that sounds familiar @bnorthan .. not sure if there's a good way around it,sadness
ImageJ,"I can't even get the `array` working personally, in the latest Fiji..",sadness
ImageJ,"Yes, the `jarray` thing is a known issue with Jython.",sadness
ImageJ,I don't think there is a way around it.,sadness
ImageJ,"So, that will be awesome for our workshop!",joy
ImageJ,@ctrueden no jython support: https://github.com/bobbylight/RSTALanguageSupport,sadness
ImageJ,Too bad Groovy is also considered broken right now.,anger
ImageJ,@hinerm the code segment above only works with imagej-ops 0.16. ,sadness
ImageJ,"Oh, it is `array`",surprise
ImageJ,so you don't have the context of the full stack trace to blacklist something,sadness
ImageJ,"@ctrueden, @hinerm  \n\ndoes the content assist work for groovy??\n\nspeaking of groovy the following code does not work because ArrayList is not converted.  I can work around it using the Dimensions interface, but it would be nice to be able to use the concise call in the workshop.  \n```\n// @OpService ops\n\nops.create().img([20,20])\n```",sadness
ImageJ,it doesn't work for groovy yet :(,sadness
ImageJ,I am 99% sure it won't work because I have never actually used them.. :D,sadness
ImageJ,haha and they don't build,joy
ImageJ,@hinerm thanks Mark.  I'll take a look at it and let you know. ,love
ImageJ,@hinerm when running mvn it seems to fail on the ConversionUtilsTest\n\n>ConversionUtilsTest.testPrimitiveArray:266->setFieldValue:531 \u00bb ClassCast [I c...,sadness
ImageJ,Did I mess up the include/import procedure?,fear
ImageJ,@NoamGit you are almost certainly missing the Maven dependencies of the Trainable Weka Segmentation plugin,fear
ImageJ,"@dscho  Sorry for these very basic questions, but can I specify it as parent POM by simply adding \n'''\n<parent>\n\t\t<groupId>sc.fiji</groupId>\n\t\t<artifactId>pom-fiji</artifactId>\n\t\t<version>9.0.0</version>\n\t\t<relativePath />\n\t</parent>\n'''\nto the project pom.xml?",fear
ImageJ,@dscho It seems that Google Code shut its doors yesterday. Several jobs reference it:\n```\n$ grep code.google jobs/*/config.xml\njobs/Fiji-synchronizer/config.xml:    https://code.google.com/p/fiji-bi/=https://code.google.com/p/fiji-bi/ \\\njobs/ImageJA-synchronizer/config.xml:    https://code.google.com/p/fiji-bi.imageja/\njobs/MSysGit-Git-Git-Mirror/config.xml:# https://code.google.com/p/msysgit.4msysgit/</command>\njobs/MSysGit-Git-Mirror/config.xml:#    https://code.google.com/p/msysgit/</command>\njobs/ThunderStorm-Git-Mirror/config.xml:    https://code.google.com/p/thunder-storm/ \\\n```\nWould you agree that I should remove those repos from those jobs?,sadness
ImageJ,"A little bit surprising, given that they promised to turn things read-only.",surprise
ImageJ,"It's just that ImageJA-synchronizer tried to push to Google Code due to changes on the other side, which of course failed.",sadness
ImageJ,"Yep, MSysGit is lying on the beach, enjoying the sun.",joy
ImageJ,Thanks for the advice\u2014I will file an issue for it.,joy
ImageJ,The Git for Windows website is looking awesome now. :+1:,joy
ImageJ,Except that the version tag is missing.,sadness
ImageJ,"Tons of work to do, still.",sadness
ImageJ,"I was reading the governance model page, which is nice.",joy
ImageJ,"Hey, that's almost looking like a flat bell curve!",surprise
ImageJ,@ctrueden  sorry I missed this.   Would you be available to meet at 4:00 eastern/3:00 central??  Or later in the week if that doesn't work. ,sadness
ImageJ,thanks for the release @hinerm @ctrueden ,joy
ImageJ,@ctrueden sounds good,joy
ImageJ,@dietzc thanks a lot.  Those instructions were useful.  I have some more questions which I will post to the dev list. ,joy
ImageJ,actually I'm not sure if the imagej-dev list is the right place for KNIME related prolems,fear
ImageJ,Hah! Gotcha.,joy
ImageJ,I even did JavaDoc. Wow ;-),joy
ImageJ,I may convert some Java examples only to scripts. Still cogitating. The UsingOps example is still a pain in Java due to lack of sufficient type-safe method signatures.,anger
ImageJ,"Actually it doesn't completely work on the topic branch right now due to `add(Img, Img)` no longer matching as expected.",sadness
ImageJ,This works with the \Confocal Series\ sample image.  The only hiccup is I can't figure out how to set the axes on the new image....  ,sadness
ImageJ,"After mucking around with the ImageJ tutorials a bunch on a topic branch, I was reminded why I had them structured as separate JARs... and I'm not sure how to proceed.",fear
ImageJ,It's the two-edged sword of extensibility once again. Some of the tutorials add rather disruptive extensions to the context.,anger
ImageJ,And some of those could be Java sources\u2014that is fine. But that only works for single-file Java sources which are \runnable\ in some sense.,sadness
ImageJ,Some of the tutorials are not really runnable from Script Editor. E.g.: the new module preprocessor plugin.,sadness
ImageJ,@dietzc thanks for the suggestion but it didn't work.  ,sadness
ImageJ,Would really appreciate!,love
ImageJ,Because it can't be shared publicly?,sadness
ImageJ,"@gab1one: Oh yeah, cool.",joy
ImageJ,like this :D,joy
ImageJ,"If you think so, then great. You're the one who knows the requirements for the problem. :smile:",joy
ImageJ,It's nice that your data is so clean and nearly noise free.,joy
ImageJ,"yeah, but i still am missing the finishing step",sadness
ImageJ,effort appreciated! ,love
ImageJ,"if we can nail that down, that would be so cool",joy
ImageJ,i'm getting some bars when plotted :(,sadness
ImageJ,"followed by create selection, when i click on save coordinates the selection disappears i dont know if thats what is causing problem",fear
ImageJ,I have to run; I think you have what you need. Best of luck with your project.,joy
ImageJ,yes but this is not what i wanted,sadness
ImageJ,I think you choose the wrong plotter for this,sadness
ImageJ,what would be the right way in that case?,fear
ImageJ,Fellas my query still goes unresolved,sadness
ImageJ,how can i send u the data points,fear
ImageJ,cool,joy
ImageJ,"ok, the points are correct, but exel is definitely not the right tool to plot it. Generally not a good the best idea to plot pixel values with a scatter plot..",sadness
ImageJ,"glad that works but im afraid i wanted something else,..",fear
ImageJ,"i used [KNIME](https://www.knime.org/)  for that, its free, open-source and awesome, but I might be biased  :D  ",joy
ImageJ,It's not a show stopper.  The script still functions.  I just can't create a display when creating the new ImgPlus with meta data.,sadness
ImageJ,One thing I was wondering: why do you use `display.createDisplay` instead of `ui.show`?,surprise
ImageJ,"BTW, I still didn't have time to track down the bug above; will discuss with @hinerm tomorrow morning.",sadness
ImageJ,"OK, sounds good.",joy
ImageJ,Cool.,joy
ImageJ,"really, really strange",surprise
ImageJ,the problem is that you are copying all of the metadata about the original `ImgPlus` even when it's not applicable,anger
ImageJ,":worried: I was thinking `ImgPlus(Img, CalibratedSpace)` but since we can't cast in python that won't work..",fear
Jhipster,"Welcome everyone, I officially announce this chat room opened!",joy
Jhipster,thank you for the great piece of generator,love
Jhipster,"Nice ! I asked about the mailing list because I think more people could ask more questions, share some thoughts, help each other... Twitter is too restrictive, github issues too formal and I've seen people losing credibility on stackoverflow because of nothing. But I got your point, this might be helpful enough. Thanks",joy
Jhipster,Awesome,joy
Jhipster,"hey guys, does anybody have an idea to reduce the switches further in this [PR](https://github.com/jhipster/generator-jhipster/pull/1496)",fear
Jhipster,"i'have create a jhisper app. It work on spring-boot, but when i put the generate war in tomcat 7,  i have this error java.lang.NoSuchMethodError: javax.servlet.ServletContext.getVirtualServerName()Ljava/lang/String;",fear
Jhipster,Looks like a wrong version of the Java EE APIs,sadness
Jhipster,That should be OK then,joy
Jhipster,good news :),joy
Jhipster,Same issue here with Grails: https://jira.grails.org/browse/GRAILS-12105,sadness
Jhipster,"OK, found the solution: http://www.concretepage.com/forum/thread?qid=291",joy
Jhipster,"effectively, i've removed tomcat-embed-core-8.0.20.jar, etc. libs and it work now...",joy
Jhipster,"on tomcat 8, my war works too :)",joy
Jhipster,"OK, if you can deploy on Tomcat 8 that's perfect",joy
Jhipster,"on my laptop yes, on our test server with jenkins, it require a bit work...",sadness
Jhipster,Thanks for the tip about the directory exclusions for IntelliJ Henri.  I've been using the \show grunt tasks\ in IntelliJ along with the Gradle window to execute bootRun and serve from the IDE.  So far so good...,joy
Jhipster,"Hello all, I love the idea of jhipster, and have played with it a bit, but I have some concerns about it and would like to hear your opinions of them:",fear
Jhipster,"First up, I don't like the monolithic nature of the thing generated in one big fat directory and would prefer seperate projects. I could split it up post generation, but then I couldn't use the workflow to add more tables/relationships/etc easily. So I thought maybe it'd be possible to have a few directories in a tree. Something like generator top level where the yeoman stuff is stored, and subdirs for db access, front end, split away from each other and able to be worked on independently and released independently with different life cycles.",anger
Jhipster,Obviously the monolithic style should be retained as default. However it'd be really nice if it supported a split out layout.,sadness
Jhipster,"OK, got the latest fired up here, metrics work java -jar target/*.war on my local amd64 Ubuntu box, but not on my server with the same war in i386",fear
Jhipster,"I recall being able to get it into a confused state where other menus also wouldn't work, but not the details, and my memory may be wrong.",sadness
Jhipster,Ha! Solved. Adblock plus was killing it. :-D Wish I'd realised that last time. Looks neat :-),joy
Jhipster,hey guys. just a question. how hard would be to pivot jhipster to a microservice generator with an optional UI ?,fear
Jhipster,Does anybody got a clue how to simply add a custom angular route quickly ? I tried to use angular-fullstack generator but it seams that JHispter is using the same structure but not the plugin.,fear
Jhipster,"I just give a try to angular-fullstack but you can not just add a route without creationg a full application and this is not the qucik, clean, easy solution i want :) Will try angular.",sadness
Jhipster,"yes, with angular too it is not  directly working. ",sadness
Jhipster,"Good to hear you're at least partially open to it, anyway :-)",joy
Jhipster,"in any case, i love what you've done, it gives me a single-handed chance at doing a full fledged web app for my project ",joy
Jhipster,we talk about different things I'm afraid,fear
Jhipster,"yes, understood",joy
Jhipster,"and it's nice to depend on the released artifact and solely develop and build the things that depend on that, above",joy
Jhipster,"I hate multi-project modules with Maven, but I'm not doing JHipster only for myself, that's why we have different options in the generator :-)",anger
Jhipster,"i hate them, too",anger
Jhipster,"exactly, and you could more easily say that a particular artifact was stable.",joy
Jhipster,"so it's a bit complicated to know what should be put in a lib, and what should be generated",fear
Jhipster,I like the ideea of having multiple jshipster apps talking to each other via REST. maybe also by some messaging system?,joy
Jhipster,not a big fan of maven modules especially created based on application layers,sadness
Jhipster,Hi guys I have some entities which work fine in dev mode but after the grunt compression some of them fail. Which is the best place to start to fix this.,fear
Jhipster,"I can see the rest resources request, the html file, which are all the same in the target folder but the table is not rendered. And clicking the create button just opens up the dialog with missing buttons.",fear
Jhipster,Thanks I'll try to debug this on JS level to see what is happening.,joy
Jhipster,"Can't say i was expecting that to be so in-your-face, sorry.",sadness
Jhipster,"I'll stick with jhipster 2.X, thanks :-) Cheers for the link, though.",joy
Jhipster,"Perfect! I was thinking the same thing, just getting through my dinner before commenting :-)",joy
Jhipster,@jdubois @fredcooke Spring Cloud Netflix - got my head spinning ,sadness
Jhipster,"@jdubois the netflix stack is awesome. We've used only some parts of it yet (hystrix, archeus) but ir really rocks! So jhipster build on spring boot netflix would be awesome!",joy
Jhipster,"Hello, I wonder why directory  bower_components/ isn't mentioned in .gitignore file so that i won't be versioned?",fear
