Channel,message,category
Freezing Moon - Ancient Beast,but i think im ready to try and code some of those upgrades now :),joy
Freezing Moon - Ancient Beast,good ^^,joy
Freezing Moon - Ancient Beast,"some of the Abolished's ability coding could get clean-up for sure, lots of nested if statements that aren't even required anymore, legacy logic",sadness
Freezing Moon - Ancient Beast,and that's usually the first file people tend to check out and get intimidated,sadness
Freezing Moon - Ancient Beast,"I'm constantly improving things, so if I keep at it, things should scale nicely for sure",joy
Freezing Moon - Ancient Beast,"i saw a bit of that, but mostly a code organization issue, not a design problem.. anyway just my first impression of the code base... looks pretty decent to me even with that",joy
Freezing Moon - Ancient Beast,"the guy who coded it is quite amazing, he's a really great artist and wants to pursue that path, so he'll be able to rejoin a bit later on when the focus is primarily on eye candy and animation",love
Freezing Moon - Ancient Beast,you're both from same country :D,joy
Freezing Moon - Ancient Beast,"@DreadKnight wonders how to get nickname autocompletion around, tab key not working hmm",fear
Freezing Moon - Ancient Beast,"Right now I'm trying to fix my profile picture. I did change it, but it still shows me the default one",sadness
Freezing Moon - Ancient Beast,it looks pretty good as-is nowaday as well! sure it's not the most beautiful game in the world but it's really above average.. have u guys put any though on how ai and network play should be done in the future (sorry if I am afk focusing on hacking stuff),joy
Freezing Moon - Ancient Beast,Which is a weird polygon of some sorts,sadness
Freezing Moon - Ancient Beast,@tukkek tries to change @Zephyrum  avatar by force but fails,sadness
Freezing Moon - Ancient Beast,"@Zephyrum yeah, it is kinda weird, it might update later on, as they have some server caching",sadness
Freezing Moon - Ancient Beast,"argh, I can never get quotes to work properly",sadness
Freezing Moon - Ancient Beast,"Still trying to get used to this chat, it's sort of  uncommon",sadness
Freezing Moon - Ancient Beast,"omg bbq, I can't get quotes to work like that for me ",fear
Freezing Moon - Ancient Beast,"> omg bbq, I can't get quotes to work like that for me ",fear
Freezing Moon - Ancient Beast,"> omg bbq, I can't get quotes to work like that for me \n\nI just click on the \Quote\ chat option",fear
Freezing Moon - Ancient Beast,"yes, but what to do after? ctrl + enter and then type?",fear
Freezing Moon - Ancient Beast,"tried that before, meh",sadness
Freezing Moon - Ancient Beast,"> yes, but what to do after? ctrl + enter and then type? bacon",fear
Freezing Moon - Ancient Beast,^ bad.,sadness
Freezing Moon - Ancient Beast,"> Shift-enter, as if typing a new paragraph\nbacon, works!",anger
Freezing Moon - Ancient Beast,> This is a fake quote.,sadness
Freezing Moon - Ancient Beast,fail,sadness
Freezing Moon - Ancient Beast,> Will not work\nLike this,anger
Freezing Moon - Ancient Beast,"true, it's how markdown works, forgot",sadness
Freezing Moon - Ancient Beast,haha,joy
Freezing Moon - Ancient Beast,seems you're better at this compared to me,love
Freezing Moon - Ancient Beast,too much shitposting on forums; learned how to get used to weird formatting,anger
Freezing Moon - Ancient Beast,"@Zephyrum woot! so i need to start with @ to mention someone, like on twitter / fb",sadness
Freezing Moon - Ancient Beast,"This smileys/emoticons roster is pretty weird, why does anyone need a \large blue circle\ in a conversation is beyond me",anger
Freezing Moon - Ancient Beast,"ahahahaha ikr, maybe it's useful for doing bullet lists or indicating status of something",joy
Freezing Moon - Ancient Beast,yea i guess if network play is ready the ai is not that important anyway! do you guys have any idea how to print a variable value for debugging pruporses? window.alert doesn't seem to work,fear
Freezing Moon - Ancient Beast,more importantly when I run  `grunt` does it launch the version under the folder \development\?,fear
Freezing Moon - Ancient Beast,@tukkek yes! grunt is all about the development atm,joy
Freezing Moon - Ancient Beast,"will try to make that more clear, I see how \stable\ vs development can be confusing, setting more stuff into place with time related to that",sadness
Freezing Moon - Ancient Beast,that would be awesome! i guess the design is already pretty good for a gamepad huh.. i wanted to add gamepad support for javelin but there is so many commands it's not really possible,joy
Freezing Moon - Ancient Beast,"@Zephyrum yeah, constantly thinking of that, but current engine doesn't do 3d, which will be required xD so I'm guessing there will be a port eventually",sadness
Freezing Moon - Ancient Beast,"there is so much that can be done with this game, im getting pretty hyped here.. somebody hold me please xD",joy
Freezing Moon - Ancient Beast,voice recognition: please let me summon creatures by shouting their names like a bad-ass xD,joy
Freezing Moon - Ancient Beast,"haha, a lot of people love mobas because they like clicking a lot, but those type of games don't scale uber well with a lot of tech tbh",joy
Freezing Moon - Ancient Beast,"yeah, hard to imagine a moba played with oculus for example.. unless you're just using it as an alternate screen that is attached to your face",anger
Freezing Moon - Ancient Beast,"there was a moba made for tablets... and supposedly optimized and bs... but the guys in the trailer were tapping the tablet screens like fucking morons, you would imagine the cracking in no time",anger
Freezing Moon - Ancient Beast,"I rage so much while playing on the PC, would probably just smash the tablet to pieces after a few dozen games tops",anger
Freezing Moon - Ancient Beast,It is not healthy for your phone,sadness
Freezing Moon - Ancient Beast,"maybe if someone made a 1st person view for mobas that would really put you in on the action but idk any that is like that... actually i saw one fps moba once but it wasnt that good, not even when compared to the classics",sadness
Freezing Moon - Ancient Beast,"played on a neighbour chick's phone a 3vs3 one and I was tapping all around yet still winning, it was pretty easy stuff overall",joy
Freezing Moon - Ancient Beast,"Smite is the closest to that, but honestly I can't see that working",sadness
Freezing Moon - Ancient Beast,"It kills your capacity to view your surroundings, you can literally only see what is in front of you",sadness
Freezing Moon - Ancient Beast,the fact the distributor for smite in here is shitty and does all they can to leech money effortlessly does not help >.>,anger
Freezing Moon - Ancient Beast,"sanity check: units can never have negative hp, right? once they reach 0 they're gone?",fear
Freezing Moon - Ancient Beast,most of the time you see your character's back mostly.... which is distracting,anger
Freezing Moon - Ancient Beast,"I was constantly pissing off the initial developer  because of stuff like that, but otherwise things would be too alike",sadness
Freezing Moon - Ancient Beast,"...I am playing a strategy game (EU4) right now, and the protestant reformation just started in Transylvania somehow. >.>",surprise
Freezing Moon - Ancient Beast,"@tukkek yeah but I'm a crappy programmer, can't manage to code AB gameplay properly for now, or things would have been way further ahead",sadness
Freezing Moon - Ancient Beast,"I wanted to convert Sweden to protestant, but the goddamn protestantism spawned on the other end of Europe. #ThanksGame",anger
Freezing Moon - Ancient Beast,"@Zephyrum haven't really played any of the civilization games myself :/ so many good old school games mentioned today that I haven't touched, only researched",sadness
Freezing Moon - Ancient Beast,(btw the abolished's drawing is so fabulours i can't handle it haha just look at it all flaming and stuff!),joy
Freezing Moon - Ancient Beast,"@tukkek if it's not blocked; don't recall if it's coded, but we had some corrections to the formula to avoid ending up with NaN and have playtest ruined thanks to badly coded effects and scenarios",sadness
Freezing Moon - Ancient Beast,> (btw the abolished's drawing is so fabulours i can't handle it haha just look at it all flaming and stuff!)\n\n^ perfect depiction of me when I first saw the drawings,joy
Freezing Moon - Ancient Beast,"good, cause he's a Pride creature after all, @tukkek - might even be might favorite unit xD",joy
Freezing Moon - Ancient Beast,"hahaha i'm loving it. @DreadKnight  ok, this can be changed later as well, i was just wondering if i did my math wrong",joy
Freezing Moon - Ancient Beast,"And then it plays out with historical stuff and so on; empires powerful at the time like France and the turks tend to grow quickly while nations who fell like the byzantine empire dies early on; however, this game always finds a way to screw up history and have something stupid happen xD",joy
Freezing Moon - Ancient Beast,"Like appearently having Martin Luther be born in romania, but hey... It's still fun :p ",joy
Freezing Moon - Ancient Beast,aww hungary converted transylvania back into catholic xd,surprise
Freezing Moon - Ancient Beast,"the most obnoxious possible spawns for protestantism ever in this game - transylvania, hungary, sweden and normandy, but nothing in germany...",anger
Freezing Moon - Ancient Beast,funny seeing different spellings of the same thing,surprise
Freezing Moon - Ancient Beast,"good, I'm confident you'll manage; he's most used after all, so it's important xD",love
Freezing Moon - Ancient Beast,it's almost done :),joy
Freezing Moon - Ancient Beast,@DreadKnight you're in the wrong neighborhood https://i.gyazo.com/75a78c223ed7aecdacc64f5bfaed976a.png,sadness
Freezing Moon - Ancient Beast,"Oh, nice; the chat inlines image links",joy
Freezing Moon - Ancient Beast,And doesn't crop it!,fear
Freezing Moon - Ancient Beast,"Yeah, nice upgrade compared to most IRC clients",joy
Freezing Moon - Ancient Beast,"@tukkek should have picked a harder one, haha; some of the other ones will probably intimidate some less chatty coders for sure",joy
Freezing Moon - Ancient Beast,"still wondering how the turks aren't snowballing into europe nor asia, but I'm not complaining :p ",surprise
Freezing Moon - Ancient Beast,"the edit feature here is pretty nice, lack of sleep makes me a bad typer :P",joy
Freezing Moon - Ancient Beast,"yeah, I always like to edit stuff xD",joy
Freezing Moon - Ancient Beast,"@Zephyrum as a history buff that you are, you'll probably love the eventual Kingdom Wars AB mode",joy
Freezing Moon - Ancient Beast,woot nice,joy
Freezing Moon - Ancient Beast,sounds nice though,joy
Freezing Moon - Ancient Beast,been a while since I last played homm3; got a new monitor and it looks a-w-f-u-l because the screen won't resize and the game doesn't have an option to change screen size :/,anger
Freezing Moon - Ancient Beast,I'm not buying that,anger
Freezing Moon - Ancient Beast,"ikr, lame; a lot of fans hate the price tag and greediness",sadness
Freezing Moon - Ancient Beast,nice :),joy
Freezing Moon - Ancient Beast,the HD remake is nice I guess,joy
Freezing Moon - Ancient Beast,but not good enough,sadness
Freezing Moon - Ancient Beast,it did make some units look less like there's a fog over them,sadness
Freezing Moon - Ancient Beast,"was strange to see that some of the units were made from parts, heh",surprise
Freezing Moon - Ancient Beast,"But no real big change; animations still very similar and stuff. All of that, and you get to miss out the two expansions and the ease to mod the game",sadness
Freezing Moon - Ancient Beast,"anyway, gameplay is really flawed to me, easy to exploit AI and such",anger
Freezing Moon - Ancient Beast,"even the non-symmetry of the combat field itself, one of the sides a big advantage for no real reason",anger
Freezing Moon - Ancient Beast,well it's an old game,sadness
Freezing Moon - Ancient Beast,"yes, but some new games tend to be made without using the old stuff properly as a base, they skip most of golden stuff altogether and make some new crap that has its own issues",anger
Freezing Moon - Ancient Beast,never really noticed an advantage due to that assymmetry,sadness
Freezing Moon - Ancient Beast,"@Zephyrum haha, that was the stuff I was talking about regarding the article I should write; the left side and right side corners have different number of adjacent tiles, I think that on the left side, the units in corners are more protected against melee attackers, as less units can fit near them",joy
Freezing Moon - Ancient Beast,"so that campaign made me realize the big issue, one extra hexagon can make all the difference",joy
Freezing Moon - Ancient Beast,"but exactly 1 hp? there's some randomness in Homm3, hits aren't always the same - how does that work? xD",fear
Freezing Moon - Ancient Beast,is that inside /deploy ?  or is that folder generated dynamically?,fear
Freezing Moon - Ancient Beast,"The campaign was uber hardcore; it implied low level units with low amounts of damage, so 1-2 points or so",sadness
Freezing Moon - Ancient Beast,"@tukkek deploy yeah, sorry, typed path by hand",sadness
Freezing Moon - Ancient Beast,"it's a bit annoying when others patch something and I don't understand the patch, because it means in case of something, I can't maintain it myself",anger
Freezing Moon - Ancient Beast,ok can u help me out a bit with changes to plasma field? i left this one for last since it's a bit more confusing than the others,fear
Freezing Moon - Ancient Beast,\The shield is no longer triggered when Dark Priest is active\ -> is this something that needs to be done or is it working like that already? (easier to ask than test),anger
Freezing Moon - Ancient Beast,"i'll test it then np, was just gonna ask about units and powers that could help so thx ",joy
Freezing Moon - Ancient Beast,also is there any other similar ability that causes counter damage like the upgraded version of plasma field proposes?,fear
Freezing Moon - Ancient Beast,"and eventually animation wise, it might be a little more awkward, as he would try to move and also shield.... so that change was my latest one and I'm really happy with the idea",joy
Freezing Moon - Ancient Beast,"currently there's no other one I can think of, kinda avoided that stuff because it was problematic in a lot of cases",fear
Freezing Moon - Ancient Beast,"\it was problematic in a lot of cases\ yeah this could be harder to code in, i'll have to try it out",fear
Freezing Moon - Ancient Beast,any idea where to find/acesss queue code?,fear
Freezing Moon - Ancient Beast,sry for asking small stuff like that but until i get a good grasp on the source files and abilities/units it's easier to ask than to spend 15 minutes searching :P,sadness
Freezing Moon - Ancient Beast,i'll take a look thx,love
Freezing Moon - Ancient Beast,usually github is really useful for searching,joy
Freezing Moon - Ancient Beast,"anyway, no worries, I know my way around the code a bit",joy
Freezing Moon - Ancient Beast,sure it helps but if you already know the answer to a question it's easier than searching :),joy
Freezing Moon - Ancient Beast,"yea saw that, let's see if I can use it! Is G.abilites and Game.abilities the same thing?",fear
Freezing Moon - Ancient Beast,"not sure, some of the class namings piss me off badly",anger
Freezing Moon - Ancient Beast,yeah I'm wondering how i will get to the `queue` that is inside Game,fear
Freezing Moon - Ancient Beast,"as i said the code seem quite well structured, a bit surprising actually",surprise
Freezing Moon - Ancient Beast,send kudos to the original rpogrammer for me :),joy
Freezing Moon - Ancient Beast,i think i got how to code the counter thing but i'm having a little trouble with the coding itself (specifically Ability#target doesn't seem to be working as expected). so if u gotta go don't worry about me :) i'll keep working and hopefully you'll find some news by the morning,fear
Freezing Moon - Ancient Beast,but i'm not sure i can use that in the way you've described,fear
Freezing Moon - Ancient Beast,yeah the method Creature#takedamage has a 'ignore retaliation' argument so it's clear that something has been done like this but idk if it's exactly what i need here,fear
Freezing Moon - Ancient Beast,"right, because way back, Abolishe's passive was doing damage all around when actually receiving damage, so 2 Abolished next to each other caused issues",sadness
Freezing Moon - Ancient Beast,"i think the only way i can make this work right now is if the counter is only done when the DP takes some damage, would that be ok for now?",fear
Freezing Moon - Ancient Beast,"the main issue i'm having is that when an ability is used on a target it should set a field (Ability#target) but somehow this isn't being updated correctly.. probably because some abilities attack a hex and not a target, even though they are affecting a target",fear
Freezing Moon - Ancient Beast,"yep, that's the desired effect",joy
Freezing Moon - Ancient Beast,more desired at least,joy
Freezing Moon - Ancient Beast,but if this idea i have will work (hopefully it will) it means that it is only a solution for this ability (plasma field) and not to all counter-like abilities,sadness
Freezing Moon - Ancient Beast,"which is not the best thing, but means it will probably work as desired",sadness
Freezing Moon - Ancient Beast,it's ok; no other counter abilities atm anyway,sadness
Freezing Moon - Ancient Beast,"alright cross you fingers then, if only for this ability i can probably just use the #activeunit field we were talking about a while ago",fear
Freezing Moon - Ancient Beast,"yeah, confirmed, haven't touched that Adaptation unit design wise recently though, it's still in old style",sadness
Freezing Moon - Ancient Beast,"if I think about it, will also do damage to \organic\ attacks, which are considered \melee attacks with range\ in some way",fear
Freezing Moon - Ancient Beast,good thing you're still here just talking to you made me think of another solution :D,love
Freezing Moon - Ancient Beast,"a stretched limb can get the attacking unit damaged, while an arrow won't; but arrow at melee range would still cause the unit to be targeted by proximity",fear
Freezing Moon - Ancient Beast,"the way i'm doing i don't think i can check if the attack was a melee/limb easily, maybe it's something to be improved later on",sadness
Freezing Moon - Ancient Beast,hard to say without knowing the code better,fear
Freezing Moon - Ancient Beast,"yeah, sometimes it's really useful for me as well to just have someone to bounce ideas with, even if he doesn't contribute too much :)",joy
Freezing Moon - Ancient Beast,but seemed too much work and a bit too early to get to know all the parameters required,sadness
Freezing Moon - Ancient Beast,oh nice just saw that melee is calculated exactly the way it's necessary for this to work :D,joy
Freezing Moon - Ancient Beast,thought it was hard to figure it out... but it's good news,joy
Freezing Moon - Ancient Beast,"i agree, first things first: making a fun game that can be played",joy
Freezing Moon - Ancient Beast,and enjoyed,joy
Freezing Moon - Ancient Beast,it works :D,joy
Freezing Moon - Ancient Beast,good stuff! i was hoping to add a feature to help debugging but i guess it's too late to start that today :P,joy
Freezing Moon - Ancient Beast,because today i had to change the value of hardcoded upgrades to 1 manually,sadness
Freezing Moon - Ancient Beast,"figured; and even later on, there's no UI setting for 1",sadness
Freezing Moon - Ancient Beast,if somehow i pushed that into the source code by mistake it would be a huge problem,fear
Freezing Moon - Ancient Beast,"there used to be lame settings with low time pools or just a few plasma point pools, not useful for real gameplay, but useful for testing indeed",sadness
Freezing Moon - Ancient Beast,yeah exactly that but without a system for that if a programmer starts messing around with 'testing features' then it could somehow end up in the code if he is not careful about returning things to their original state,fear
Freezing Moon - Ancient Beast,i really won't have time to do that tomorrow but maybe next week :) it's a simple thing but helpful but gotta figure out how to do it properly,sadness
Freezing Moon - Ancient Beast,"well, all actions get logged atm and can be replayed, so that's helpful",joy
Freezing Moon - Ancient Beast,alright i'd have to see how it's programmed then :) but rly if you think i'd be a good asset for the team i'd ask you to start working on that networking code asap.. we could use it for the undo and replay features as well,joy
Freezing Moon - Ancient Beast,plus getting to play the game with you guys would be a total winner :D,joy
Freezing Moon - Ancient Beast,"that guy from London, he's my best buddy",love
Freezing Moon - Ancient Beast,"and after a few matches, he tends to learn all the stuff and beat the crap out of me at my own game xD",joy
Freezing Moon - Ancient Beast,sounds like a nice guy :),love
Freezing Moon - Ancient Beast,good thing there's a 2vs2 and could play along with him vs others,joy
Freezing Moon - Ancient Beast,"I lost quite a few beers vs him, had to put a cap and try to earn back some of them",sadness
Freezing Moon - Ancient Beast,oh yeah absolutely! man i'm dying to play a match of this online hahah,joy
Freezing Moon - Ancient Beast,"interesting but online games are easy to cheat, we'd have to make sure cheating is very hard to do",fear
Freezing Moon - Ancient Beast,yeah that is something easier to do when the online play is working.. so you can test against other people + having fun while playtesting :D,joy
Freezing Moon - Ancient Beast,"yeah, didn't like it as much as the original C&C games though",sadness
Freezing Moon - Ancient Beast,"anyway, they're putting bountysource.com to really good use",joy
Freezing Moon - Ancient Beast,u said the changes would take 2-3 hours but it was more like 6 haha good thing i had the whole day for that :),joy
Freezing Moon - Ancient Beast,"well if you want my help i'd be glad to give it, had a lot of fun today plus i think the game can get really good",joy
Freezing Moon - Ancient Beast,"yeah, i'm not complaining just commenting on it.. also if i had more experience with the codebase maybe it would have taken only 2-3h indeed",sadness
Freezing Moon - Ancient Beast,"it's your choice, as I said.. sometimes many developers can be a problem as well",sadness
Freezing Moon - Ancient Beast,i guess you're already getting a lot of work done with these tests :D that's a good thing too,joy
Freezing Moon - Ancient Beast,i wish i could do this kind of work for free as well but unfortunately it's not possible right now.. but it would be a dream come true to work full time on a project like this,sadness
Freezing Moon - Ancient Beast,kind of a small change in that patch but good to receive contributions like that,joy
Freezing Moon - Ancient Beast,"it's not working code, just pseudo code",sadness
Freezing Moon - Ancient Beast,maybe not even good pseudo code,sadness
Freezing Moon - Ancient Beast,"code looks good, will do tests tomorrow, will have to merge first probably regardless",joy
ImageJ,"Well I'm a fool, I pushed the button",sadness
ImageJ,"Ha ha, welcome Lee. :-)",love
ImageJ,"And: happy Super \u03c0 day. It already passed here... (not the entire day, but 9:26:53 am)",joy
ImageJ,welcome!,love
ImageJ,thanks hinerm for the help on github,love
ImageJ,"sure @dietzc , hope it's helpful :bug: ",joy
ImageJ,@rishabhsethi Not yet as an end user application. But much groundwork was done with the ImageJ2 project to facilitate a future Android-based version.,sadness
ImageJ,@ctrueden thanks for replying. Actually what I want to do is subtract background from an image and filter noise and then use threshold algorithm to detect areas of interest in the image. I dont want it to be a client side application. Just need to perform these tasks on an image. Is this possible? Could you please guide me on how to proceed? Thanks.,fear
ImageJ,"Sorry. I didn't understand that correctly. I want to create an android app which takes in an image and perform those operations on that image. So, I want to use imageJ's algorithms (by using imageJ's api) in some way in the app to analyse the image. I thought that by end user you meant that imageJ doesn't have an app on android similar to other desktop environments. If that is not possible, is there any way I can do it. Thanks a lot for answering.",fear
ImageJ,"That said, if you are looking for a \quick\ solution, ImageJ will not fit the bill\u2014substantial work is likely required.",sadness
ImageJ,"If you are looking to call _ImageJ1_ plugins, then it will be nigh-impossible, because ImageJ1 is very tightly coupled to AWT, which is not available on Android.",sadness
ImageJ,OK thanks a lot. Will have to look for something else then :worried: ,fear
ImageJ,"All right, back to Dragon Age for me! Woo!",joy
ImageJ,hi all! I'm back,joy
ImageJ,Welcome back!,love
ImageJ,"@dscho Sure, no problem.",joy
ImageJ,@dscho I noticed that PAvel has a GitHub account now! And an org. That is great!,joy
ImageJ,"The good GitHub people have this program where scientific labs an apply for a free silver plan, and we did, and got accepted.",joy
ImageJ,"Sure, if you like! I am fine either way.",joy
ImageJ,That's very cool about the silver plan for academia.,joy
ImageJ,They're really good people.,love
ImageJ,Major progress on the ImageJ OPS built-ins branch last night!,joy
ImageJ,Now it's just a matter of adding in the built-in methods one by one. Alison is going to do it starting Tuesday. :-),joy
ImageJ,@ctrueden great. great! great! ,joy
